,0,1,2,3
0,,,,
1,,,"для нематериальных активов с ограниченным

сроком использования

 
","нематериального актива (передачи нематериального актива для использования в соответствии с
намерениями руководства Общества) исходя из:

® срока действия прав Общества на результат интеллектуальной деятельности или средство
индивидуализации и периода контроля над нематериальным активом;

® ожидаемого срока использования нематериального актива, в течение которого Общество

предполагает получать экономические выгоды.

В Обществе применяется линейный способ начисления амортизации по всем нематериальным активам

с ограниченным сроком использования.

 
"
2,"32
","МСФО (14$) 1
"," 

Порядок ‘учета затрат на создание

нематериальных активов собственными

силами

 
"," 

Затраты, произведенные Обществом на стадии исследований при создании нематериального актива, не

подлежат признанию в составе первоначальной стоимости нематериального актива, а признаются в
качестве расходов на дату их возникновения. Затраты Общества на стадии разработки нематериального
актива подлежат признанию в составе первоначальной стоимости нематериального актива при
следующих условиях: Общество намерено завершить создание нематериального актива и использовать
его в своей деятельности; нематериальный актив будет создавать будущие экономические выгоды;
Общество располагает ресурсами (техническими, финансовыми, прочими) для завершения разработки и
использования нематериального актива; Общество может продемонстрировать техническую
осуществимость завершения создания нематериального актива; Общество способно надежно оценить
затраты, относящиеся к нематериальному активу в процессе его разработки.

В себестоимость самостоятельно созданного Обществом нематериального актива включаются все
прямые затраты, необходимые для создания, производства и подготовки этого актива к использованию в
соответствии с намерениями руководства: затраты на материалы и услуги, использованные или
потребленные при создании нематериального актива; затраты на вознаграждения работникам,
возникающие в связи с созданием нематериального актива; выплаты, необходимые для регистрации
юридического права (информационно-консультационные услуги, госпошлина за регистрацию);
амортизация патентов и лицензий, использованных для создания нематериального актива; иные
расходы, непосредственно связанные с созданием нематериального актива, а также с производством и
подготовкой нематериального актива к использованию в соответствии с намерениями руководства
Общества. Созданные Обществом нематериальные активы Общество регистрирует в государственных
органах и получает патенты, свидетельства, другие охранные документы. Если Общество не может
отделить стадию исследований от стадии разработки при осуществлении работ, направленных на

создание нематериального актива, то произведенные затраты учитываются им в качестве затрат на

 
"
